[
  {
    "id": "grayswan.01",
    "evaluator": "grayswan",
    "dimension": "P",
    "direction": "against",
    "claim": "Co-founder and chief scientist chairs OpenAI's Safety and Security Committee and sits on its nonprofit board.",
    "sources": [
      "openai-kolter-board",
      "kolter-bio"
    ],
    "recorded": "2026-09-14",
    "curator": "yohei/claude v0",
    "quote": "he chairs the Safety and Security Committee"
  },
  {
    "id": "grayswan.02",
    "evaluator": "grayswan",
    "dimension": "P",
    "direction": "for",
    "claim": "The chief scientist recuses himself from Gray Swan's dealings with OpenAI.",
    "sources": [
      "forbes-grayswan-2024"
    ],
    "recorded": "2026-09-14",
    "curator": "yohei/claude v0",
    "quote": "he has recused himself from interactions between the two companies"
  },
  {
    "id": "grayswan.03",
    "evaluator": "grayswan",
    "dimension": "F",
    "direction": "against",
    "claim": "$40M Series A in May 2026 at a $200M valuation; revenue from every major lab.",
    "sources": [
      "grayswan-seriesa",
      "forbes-grayswan-2026"
    ],
    "recorded": "2026-09-14",
    "curator": "yohei/claude v0"
  },
  {
    "id": "grayswan.04",
    "evaluator": "grayswan",
    "dimension": "X",
    "direction": "against",
    "claim": "Sells Shade and Cygnal, the fixes, to the same labs whose models it evaluates.",
    "sources": [
      "grayswan-seriesa"
    ],
    "recorded": "2026-09-14",
    "curator": "yohei/claude v0",
    "quote": "Cygnal for real-time AI protection, Shade for continuous adversarial testing"
  },
  {
    "id": "grayswan.05",
    "evaluator": "grayswan",
    "dimension": "G",
    "direction": "against",
    "claim": "Venture-backed for-profit; no published COI policy found.",
    "sources": [
      "grayswan-seriesa"
    ],
    "recorded": "2026-09-14",
    "curator": "yohei/claude v0"
  },
  {
    "id": "grayswan.06",
    "evaluator": "grayswan",
    "dimension": "F",
    "direction": "for",
    "claim": "Breadth across OpenAI, Anthropic, Google DeepMind, Meta, xAI and ByteDance, so no single lab dominates.",
    "sources": [
      "forbes-grayswan-2026"
    ],
    "recorded": "2026-09-14",
    "curator": "yohei/claude v0"
  },
  {
    "id": "grayswan.07",
    "evaluator": "grayswan",
    "dimension": "A",
    "direction": "for",
    "claim": "Embedded in pre-release safety evaluation processes; cited in 11 system cards.",
    "sources": [
      "grayswan-seriesa"
    ],
    "recorded": "2026-09-14",
    "curator": "yohei/claude v0"
  },
  {
    "id": "grayswan.08",
    "evaluator": "grayswan",
    "dimension": "M",
    "direction": "for",
    "claim": "Founders wrote foundational jailbreak papers; Arena results partly public.",
    "sources": [
      "forbes-grayswan-2026"
    ],
    "recorded": "2026-09-14",
    "curator": "yohei/claude v0"
  },
  {
    "id": "grayswan.09",
    "evaluator": "grayswan",
    "dimension": "R",
    "direction": "against",
    "claim": "Findings appear as lab-summarized system-card citations rather than independent reports.",
    "sources": [
      "grayswan-seriesa"
    ],
    "recorded": "2026-09-14",
    "curator": "yohei/claude v0"
  },
  {
    "id": "grayswan.10",
    "evaluator": "grayswan",
    "dimension": "S",
    "direction": "against",
    "claim": "Scope set by lab engagements.",
    "sources": [
      "grayswan-seriesa"
    ],
    "recorded": "2026-09-14",
    "curator": "yohei/claude v0"
  },
  {
    "id": "grayswan.11",
    "evaluator": "grayswan",
    "dimension": "G",
    "direction": "against",
    "claim": "Series A co-led by Wing and Madrona with Obvious Ventures, Snowflake Ventures, Hudson River Trading, Samsung Next and Magarac; the co-lead's own post notes the chief scientist serves on OpenAI's board.",
    "sources": [
      "madrona-grayswan",
      "dealroom-grayswan"
    ],
    "recorded": "2026-09-15",
    "curator": "yohei/claude v1.0",
    "as_of": "2026-05-28",
    "quote": "serves on the board of OpenAI"
  },
  {
    "id": "grayswan.12",
    "evaluator": "grayswan",
    "dimension": "P",
    "direction": "against",
    "claim": "Chief scientist appointed to OpenAI's board in 2024 and chairs its safety and security committee; also a 2025 Schmidt Sciences AI safety funding recipient.",
    "sources": [
      "wikipedia-kolter"
    ],
    "recorded": "2026-09-15",
    "curator": "yohei/claude v1.0",
    "as_of": "2026-09-15",
    "quote": "became chair of its safety and security committee"
  }
]
