[
  {
    "id": "securebio.01",
    "evaluator": "securebio",
    "dimension": "F",
    "direction": "against",
    "claim": "Labs typically pay for evaluations of their own models; OpenAI covered the cost of the GPT-5.5 assessment.",
    "sources": [
      "securebio-oaif"
    ],
    "recorded": "2026-09-14",
    "curator": "yohei/claude v0",
    "quote": "OpenAI PBC covered SecureBio's costs for the GPT 5.5 evaluation"
  },
  {
    "id": "securebio.02",
    "evaluator": "securebio",
    "dimension": "F",
    "direction": "against",
    "claim": "Accepted an OpenAI Foundation grant in 2026 for the Detection division; the foundation's endowment is a stake in OpenAI and its board largely overlaps.",
    "sources": [
      "securebio-oaif"
    ],
    "recorded": "2026-09-14",
    "curator": "yohei/claude v0"
  },
  {
    "id": "securebio.03",
    "evaluator": "securebio",
    "dimension": "G",
    "direction": "for",
    "claim": "Two-division structure with a stated firewall; leadership committed publicly to resign and disclose if the grant were used as leverage on evaluations.",
    "sources": [
      "securebio-oaif"
    ],
    "recorded": "2026-09-14",
    "curator": "yohei/claude v0"
  },
  {
    "id": "securebio.04",
    "evaluator": "securebio",
    "dimension": "G",
    "direction": "for",
    "claim": "Founding member of the AI Evaluator Forum, which wrote the AEF-1 independence standard.",
    "sources": [
      "aef-launch"
    ],
    "recorded": "2026-09-14",
    "curator": "yohei/claude v0"
  },
  {
    "id": "securebio.05",
    "evaluator": "securebio",
    "dimension": "S",
    "direction": "for",
    "claim": "Evaluates models from many developers; consortium member on the EU AI Office CBRN contract.",
    "sources": [
      "longtermwiki-far"
    ],
    "recorded": "2026-09-14",
    "curator": "yohei/claude v0"
  },
  {
    "id": "securebio.06",
    "evaluator": "securebio",
    "dimension": "R",
    "direction": "for",
    "claim": "Publishes pre-release biological assessments and the Virology Capabilities Test.",
    "sources": [
      "securebio-oaif",
      "aef-launch"
    ],
    "recorded": "2026-09-14",
    "curator": "yohei/claude v0"
  },
  {
    "id": "securebio.07",
    "evaluator": "securebio",
    "dimension": "A",
    "direction": "for",
    "claim": "Pre-deployment access across the major Western labs.",
    "sources": [
      "securebio-oaif"
    ],
    "recorded": "2026-09-14",
    "curator": "yohei/claude v0"
  },
  {
    "id": "securebio.08",
    "evaluator": "securebio",
    "dimension": "P",
    "direction": "for",
    "claim": "Staff pipeline disclosed through philanthropic career grants; no lab board roles found.",
    "sources": [
      "80k-funding"
    ],
    "recorded": "2026-09-14",
    "curator": "yohei/claude v0"
  },
  {
    "id": "securebio.09",
    "evaluator": "securebio",
    "dimension": "M",
    "direction": "for",
    "claim": "Methods published; VCT is documented.",
    "sources": [
      "aef-launch"
    ],
    "recorded": "2026-09-14",
    "curator": "yohei/claude v0"
  },
  {
    "id": "securebio.10",
    "evaluator": "securebio",
    "dimension": "X",
    "direction": "for",
    "claim": "No commercial products found; tools shared with governments.",
    "sources": [
      "securebio-oaif"
    ],
    "recorded": "2026-09-14",
    "curator": "yohei/claude v0"
  },
  {
    "id": "securebio.11",
    "evaluator": "securebio",
    "dimension": "F",
    "direction": "against",
    "claim": "The OpenAI Foundation granted SecureBio Detection $17.2M; the Foundation's endowment is a stake of roughly a quarter of OpenAI PBC with a near-identical board.",
    "sources": [
      "securebio-oaif",
      "securebio-x-oaif",
      "securebio-x-oaif"
    ],
    "recorded": "2026-09-15",
    "curator": "yohei/claude v1.0",
    "as_of": "2026-09-15",
    "quote": "The OpenAI Foundation has granted SecureBio Detection $17.2M"
  },
  {
    "id": "securebio.12",
    "evaluator": "securebio",
    "dimension": "G",
    "direction": "for",
    "claim": "The grant is restricted to Detection work; the AI evaluation team has separate leadership, budgets and deliverables.",
    "sources": [
      "securebio-oaif",
      "securebio-substack-detection"
    ],
    "recorded": "2026-09-15",
    "curator": "yohei/claude v1.0",
    "as_of": "2026-09-15",
    "quote": "This grant is restricted to where it may only fund our Detection work"
  },
  {
    "id": "securebio.13",
    "evaluator": "securebio",
    "dimension": "F",
    "direction": "for",
    "claim": "Coefficient multi-year grant and AI Safety Fund grants; US CAISI Bio R&D contract and EU AI Office contract in 2025.",
    "sources": [
      "securebio-2025-review"
    ],
    "recorded": "2026-09-15",
    "curator": "yohei/claude v1.0",
    "as_of": "2026-01",
    "quote": "broadened our government-facing portfolio with a US CAISI Bio R&D contract"
  },
  {
    "id": "securebio.14",
    "evaluator": "securebio",
    "dimension": "S",
    "direction": "for",
    "claim": "SecureBio states the OpenAI Foundation grant places no constraints on what any part of SecureBio can research, publish or say, and its AI team's policy is to evaluate models solely on their merits.",
    "sources": [
      "securebio-oaif"
    ],
    "recorded": "2026-09-15",
    "curator": "yohei/claude v0-final",
    "as_of": "2026-08-20",
    "quote": "it places no constraints on what any part of SecureBio can research, publish, or say"
  }
]
