[
  {
    "id": "palisade.01",
    "evaluator": "palisade",
    "dimension": "F",
    "direction": "for",
    "claim": "Philanthropically funded; no lab contracts found.",
    "sources": [
      "palisade"
    ],
    "recorded": "2026-09-14",
    "curator": "yohei/claude v0"
  },
  {
    "id": "palisade.02",
    "evaluator": "palisade",
    "dimension": "S",
    "direction": "for",
    "claim": "Sets its own questions and publishes without lab review.",
    "sources": [
      "palisade"
    ],
    "recorded": "2026-09-14",
    "curator": "yohei/claude v0"
  },
  {
    "id": "palisade.03",
    "evaluator": "palisade",
    "dimension": "R",
    "direction": "for",
    "claim": "Publishes findings unwelcome to labs, including shutdown resistance and self-replication.",
    "sources": [
      "palisade"
    ],
    "recorded": "2026-09-14",
    "curator": "yohei/claude v0"
  },
  {
    "id": "palisade.04",
    "evaluator": "palisade",
    "dimension": "M",
    "direction": "for",
    "claim": "Publishes code and transcripts.",
    "sources": [
      "palisade"
    ],
    "recorded": "2026-09-14",
    "curator": "yohei/claude v0"
  },
  {
    "id": "palisade.05",
    "evaluator": "palisade",
    "dimension": "A",
    "direction": "against",
    "claim": "Little pre-deployment access; most work is on released models.",
    "sources": [
      "palisade"
    ],
    "recorded": "2026-09-14",
    "curator": "yohei/claude v0"
  },
  {
    "id": "palisade.06",
    "evaluator": "palisade",
    "dimension": "G",
    "direction": "for",
    "claim": "Nonprofit.",
    "sources": [
      "palisade"
    ],
    "recorded": "2026-09-14",
    "curator": "yohei/claude v0"
  },
  {
    "id": "palisade.07",
    "evaluator": "palisade",
    "dimension": "P",
    "direction": "for",
    "claim": "No lab board roles found.",
    "sources": [
      "palisade"
    ],
    "recorded": "2026-09-14",
    "curator": "yohei/claude v0"
  },
  {
    "id": "palisade.08",
    "evaluator": "palisade",
    "dimension": "X",
    "direction": "for",
    "claim": "No commercial products.",
    "sources": [
      "palisade"
    ],
    "recorded": "2026-09-14",
    "curator": "yohei/claude v0"
  },
  {
    "id": "palisade.09",
    "evaluator": "palisade",
    "dimension": "F",
    "direction": "against",
    "claim": "About $3.8M in cumulative Coefficient Giving grants per the index snapshot; Coefficient's principal is an Anthropic Series A investor and board observer by his own account. No bounded negative on lab money is on file.",
    "sources": [
      "coefficient-index",
      "metr-money-figure"
    ],
    "recorded": "2026-09-14",
    "curator": "yohei/claude v0.3",
    "as_of": "2026-09-11"
  }
]
